,ItemID,CommentingUser,CommentingUserScore,CommentText,CommentTime,CommentType
0,276646642466,0***m,876,👍,2024-11-11T07:00:00.000Z,Positive
1,276646642466,o***y,311,Purchased Dyson tp4a no remote was in package Called Dyson they don’t have any rude customer service said take it up with eBay we can’t help you we don’t have any remotes . So can’t control item with no remote ,2024-11-11T07:00:00.000Z,Negative
2,276646642466,o***o,529,Good ,2024-11-11T07:00:00.000Z,Positive
3,276646642466,4***l,10,Super quiet and great purifier ￼,2024-11-11T07:00:00.000Z,Positive
4,276646642466,q***u,162,This air purifier is great for the refurbished price of $179.00. I also got a two year warranty from ebay alstate.,2024-11-11T07:00:00.000Z,Positive
5,276646642466,w***o,118,"Item did not come with remote control, it is useless without it",2024-11-04T07:00:00.000Z,Negative
6,276646642466,5***a,397,"I was received Dyson tower purifier today. Very impressive with my purchase, it’s very well packaged. nice brand new with excellent working. Highly recommended 🙏",2024-11-04T07:00:00.000Z,Positive
7,276646642466,a***m,227,Seller was non-responsive to my questions…they Did not return questions I had regarding the purchased item.,2024-10-28T07:00:00.000Z,Neutral
8,276646642466,o***w,3226,"item arrived quickly and as described, THANKS!",2024-10-28T07:00:00.000Z,Positive
9,276646642466,e***r,59,It did not come with the remote control so I can’t really use the machine. I’m going to have to order one now so I can use this. I have messaged the seller three times over the course of nearly a business week and no response. I wanted to let them make it right but there was no response so here is this review. ,2024-10-28T07:00:00.000Z,Negative
10,276646642466,c***i,11,Wow what a gem. I love that this aero dynamic tower has the power yet so quiet to feel and cool my area were I read. If this was previously used I would have been fooled to think this was brand new. Who knew bargain shopping would be so in. All the cool kids are doing it! ,2024-10-21T07:00:00.000Z,Positive
11,276646642466,n***c,174,Item as described…fast shipping.,2024-10-14T07:00:00.000Z,Positive
12,276646642466,0***c,59,Item defective - still waiting on replacement- 2 weeks,2024-10-14T07:00:00.000Z,Negative
13,276646642466,_***_,65,"great buy
",2024-10-14T07:00:00.000Z,Positive
14,276646642466,1***n,349,The air coming from Dyson fan is like a breeze.  Not noisy.  Therefore I love to keep it,2024-10-14T07:00:00.000Z,Positive
15,276646642466,0***0,365,As represented in listing--shipped quickly--5 stars & highly recommended to all!,2024-10-07T07:00:00.000Z,Positive
16,276646642466,e***a,1007,good,2024-10-07T07:00:00.000Z,Positive
17,276646642466,n***a,100,Works amazing. Air quality is what I was most impressed with. Night mode is quiet ,2024-10-07T07:00:00.000Z,Positive
18,276646642466,n***n,96,A+++,2024-09-30T07:00:00.000Z,Positive
19,276646642466,3***8,482,Fast delivery,2024-09-30T07:00:00.000Z,Positive
20,276700640888,1***0,358,Works as it should ,2024-11-18T07:00:00.000Z,Positive
21,276700640888,k***h,19,looks brand new! very happy with it,2024-11-04T07:00:00.000Z,Positive
22,276618777437,r***k,33,"second time ordered first time was I operational . This Fan ( #2 ) works as intended. But dirty and the power cord wall adapter ( the transformer ) sounds like it’s been dropped. 

I expected better from Dyson. 
",2024-11-11T07:00:00.000Z,Neutral
23,276618777437,i***n,4,"Waited one week and then the item came defective. Does not work!!
Super disappointed as now I have to wait one more week to get the return label and god knows how many weeks to get a refund so I can order a new item.

BIG MISTAKE!!! I NEEDED THIS ITEM ASAP AS WE ARE HAVING HEALTH ISSUES BECAUSE OF THE DRY WEATHER AND NEEDED A HUMIDIFIER ASAP.

STAY AWAY FROM DYSON REFURBISHED!!",2024-11-11T07:00:00.000Z,Negative
24,276618777437,e***n,176,A pleasure to do business with!,2024-11-11T07:00:00.000Z,Positive
25,276618777437,2***t,230,This comment has been removed by eBay.,2024-11-04T07:00:00.000Z,Negative
26,276618777437,e***e,474,"

I received the item, but the adapter cable is defective and the product is not functioning. This raises concerns about quality control, contrary to your advertising claims. I have reached out several times for assistance but have not received a response. I noticed similar complaints about assistance in reviews, which is concerning.

I am still awaiting a reply and a replacement for the faulty cord.
",2024-11-04T07:00:00.000Z,Negative
27,276618777437,y***a,92,Looking and working great!,2024-11-04T07:00:00.000Z,Positive
28,276618777437,7***s,505,Thanks,2024-11-04T07:00:00.000Z,Positive
29,276618777437,r***k,33,Excellent item,2024-10-21T07:00:00.000Z,Positive
30,276618777437,a***n,8,like new,2024-10-07T07:00:00.000Z,Positive
31,276618777437,i***j,359,"Pay over $400 less for a new Dyson PHO2? Twist my arm! I’m glad customers have an aversion to open boxes. It makes the deals sweet for folks like me. This machine is awesome. Set up easy, immediate results. Thanks Dyson! ",2024-10-07T07:00:00.000Z,Positive
32,276618777437,5***8,21302,Please follow the Poke_Garage!,2024-09-30T07:00:00.000Z,Positive
33,276618777437,t***i,87,Item arrived as described. Good price for refurbished item. Thank you.,2024-09-30T07:00:00.000Z,Positive
34,276618777437,e***l,464,"I received the Dyson PH02 pure humidity, turned on, worked 1 hour maximum and gt error on screen says water tank out, i requested return, and sent 3-4 texts they never responded. Now they don’t want to provide shipping label. Pure service. Even not sure this is Dyson service or not.",2024-09-30T07:00:00.000Z,Negative
35,276618777437,i***i,39,Could not be more happy. Thanks Dyson!,2024-09-23T07:00:00.000Z,Positive
36,276618777437,t***d,1288,Great seller!,2024-09-16T07:00:00.000Z,Positive
37,276618777437,c***c,122,The item looks and works like it is new.  I will definitely be buying more refurbished products from Dyson!,2024-09-16T07:00:00.000Z,Positive
38,276596530300,2***d,1526,Thank you,2024-11-04T07:00:00.000Z,Positive
39,276596530300,f***f,150,Shipped quickly and the fan looks brand new. ,2024-11-04T07:00:00.000Z,Positive
40,276596530300,i***k,790,Thank you.,2024-10-21T07:00:00.000Z,Positive
41,276596530300,w***v,448,Love it!,2024-10-14T07:00:00.000Z,Positive
42,276596530300,e***s,845,No response from seller. This is my second purchase and they send mismatched parts. Not going to buy again and will not support the brand anymore. ,2024-10-14T07:00:00.000Z,Negative
43,276596530300,j***d,433,A+,2024-10-14T07:00:00.000Z,Positive
44,276596530300,j***d,433,A+,2024-10-14T07:00:00.000Z,Positive
45,276596530300,j***d,433,A+,2024-10-14T07:00:00.000Z,Positive
46,276596530300,t***3,7,Good product ,2024-10-07T07:00:00.000Z,Positive
47,276596530300,8***v,367,Love this. Have no fear buying refurbished products from Dyson. Works perfectly!,2024-10-07T07:00:00.000Z,Positive
48,276596530300,u***t,1821,All 5 Stars!! Thank you!!,2024-09-30T07:00:00.000Z,Positive
49,276596530300,i***v,108,Greatvproduct.  Machine #4 (one in every room incl bedroom)  stylish and quiet.  This connects to app (remote control) and Alexa/Google for voice control.,2024-09-23T07:00:00.000Z,Positive
50,276596530300,t***t,2428,"Item shouldn't be listed as refurbished, it should have been listed as heavily used! When I buy refurbished items, I expected the item to be a open box return or in like new condition.  This thing looked like it was used for years and has battle wounds all over it...(Box Cutter Marks/Crack, Skuff Marks). I'm highly disappointed with this one! Grade D Condition at best! Should fall under the category: Works...but that's about it. ",2024-09-23T07:00:00.000Z,Neutral
51,276596530300,i***i,669,Received quickly works great,2024-09-16T07:00:00.000Z,Positive
52,276596530300,1***5,50,Very good,2024-09-09T07:00:00.000Z,Positive
53,276596530300,r***r,148,The item is listed as a TP04. They are selling a TP4A. These are entirely different models. This is a bait and switch listing. Really disappointing - they are sending the Costco only model but listing it like it isn’t that one. I messaged the seller and they confirmed this. ,2024-09-09T07:00:00.000Z,Negative
54,276596530300,r***3,19,"The fan works great, is in excellent condition BUT was delivered without the remote control.  There is no mention in the description that this item was being sold without the control so this is why I could not give it highest marks.  I have contacted the seller both through ebay, and PayPal  but have not received any response as to how to get the remote.  ",2024-09-09T07:00:00.000Z,Neutral
55,276596530300,5***4,100,Overnight shipping and imperfect condition! Will be using the seller again! ￼,2024-09-09T07:00:00.000Z,Positive
56,276596530300,7***7,202,remote control didn't work and was told by seller that they had no replacements and I should wait,2024-09-09T07:00:00.000Z,Negative
57,276596530300,m***m,197,Awesome product! ,2024-09-09T07:00:00.000Z,Positive
58,276596530300,4***4,176,Item Arrived quick and came as described,2024-09-09T07:00:00.000Z,Positive
59,276596530300,8***7,1065,So far so good! Thank you seller cannot wait to use it tonight and enjoy clean air in our bedroom! Thank you again.,2024-09-09T07:00:00.000Z,Positive
60,276596530300,h***c,5101,Quick Delivery. Item Received in Order. Thanks!!!,2024-09-09T07:00:00.000Z,Positive
61,276596530300,c***1,1065,As described ,2024-08-26T07:00:00.000Z,Positive
62,276596530300,!***!,421,Thanks ,2024-08-26T07:00:00.000Z,Positive
63,186709750160,d***n,344,A+++++ seller… highly recommended!!!,2024-11-11T07:00:00.000Z,Positive
64,186709750160,i***g,69,Wow looks and runs like it's brand new.sweet!,2024-11-11T07:00:00.000Z,Positive
65,186709750160,j***j,615,Works good.,2024-11-04T07:00:00.000Z,Positive
66,186709750160,0***i,142,Very happy with purchase. Item is in great condition and as described. ,2024-10-28T07:00:00.000Z,Positive
67,186709750160,e***1,1390,Was able to return item with no trouble.,2024-10-28T07:00:00.000Z,Positive
68,186709750160,t***n,382,"First, the item came quickly and was exactly what the seller said it was. Item was in very good shape. Through my error, I thought the seller sent the wrong model. Seller was responsive to my refund request and we resolved it as soon as I realized it was the right item. Thanks for a positive interaction.",2024-10-21T07:00:00.000Z,Positive
69,186709750160,h***a,387,Fast shipping. Working well,2024-10-14T07:00:00.000Z,Positive
70,186716273247,d***i,217,"Item as described, in good condition, works as expected.  Thank you!",2024-11-11T07:00:00.000Z,Positive
71,186716273247,n***t,2245,Thank you! It's great!,2024-11-04T07:00:00.000Z,Positive
72,186716273247,m***c,112,👍,2024-11-04T07:00:00.000Z,Positive
73,186716273247,3***n,93,"A really fast shipment, I would buy again from this vendor.",2024-10-21T07:00:00.000Z,Positive
74,186716273247,k***r,63,"Item works and looks like new, at a great price!
Definitely will purchase Dyson used again. So futuristic too; a fan that has a heating function AND filters your air?? YES please !!",2024-10-21T07:00:00.000Z,Positive
75,186705178844,s***s,20,Perfect and Speedy delivery.,2024-11-04T07:00:00.000Z,Positive
76,186705178844,.***l,19,"I love the older model, the new ones just scream overly complicated and likely to break when looking at how they’re designed. Anyway I was pretty excited to see this offer, it arrived quickly, looks great and runs great. I do wanna add they include a fresh Dyson branded filter which is very nice and appreciated.",2024-11-04T07:00:00.000Z,Positive
77,186760013215,g***g,1316,A+eBayer. 💙  Dyson Pure Cool Fan Tower TP01 HEPA Air Purifier w. Remote - Gray Blue SR.  Fast Shipping. Good Communication.  💙 Thank You.,2024-11-11T07:00:00.000Z,Positive
78,335659254239,a***1,554,excellent deal,2024-11-11T07:00:00.000Z,Positive
79,235616972651,u***u,1348,"Super fast shipping,  Pleasure to do business with,  Highly recommended...",2024-11-04T07:00:00.000Z,Positive
80,235616972651,u***u,1348,"Super fast shipping,  Pleasure to do business with,  Highly recommended...",2024-11-04T07:00:00.000Z,Positive
81,235616972651,a***r,425,"Flawless transaction, fast shipping! A+",2024-10-28T07:00:00.000Z,Positive
82,176567720524,w***r,177,Just as described fast shipping!!,2024-11-04T07:00:00.000Z,Positive
83,176567720524,4***-,1,"Excellent, brand new condition! Also came super fast!",2024-11-04T07:00:00.000Z,Positive
84,176567720524,o***c,135,"Motor whistles, air quality sensor doesn't work, Dyson doesn't have the parts to fix it. Oh well",2024-10-28T07:00:00.000Z,Negative
85,176567720524,b***e,90,"Quick shipping, item as described. ",2024-10-28T07:00:00.000Z,Positive
86,255865381986,d***l,124,A+++ Fast Shipping!!,2024-10-28T07:00:00.000Z,Positive
87,1111111111,v***v,13,as there where no original packaging it was very well packed with bubblewrap and neatly tied cord - as it was electronics and not in original packaging this can serve as a good test for skill of packaging. Job well done,2024-09-16T07:00:00.000Z,Positive
88,1111111111,b***i,659,"Nice color and condition, item as described, and quick shipper. Thank you!",2024-09-02T07:00:00.000Z,Positive
89,276715338156,2***u,57,"Quality product at a more reasonable price. Prompt shipment, received one day after order.",2024-11-18T07:00:00.000Z,Positive
90,276715338156,s***o,595,Describe accurately and fast shipping,2024-11-11T07:00:00.000Z,Positive
91,134938507037,3***i,3,As described. Got here quick. ,2024-10-28T07:00:00.000Z,Positive
92,256460533606,_***n,115,"Original packaging, unit works as expected ++",2024-09-23T07:00:00.000Z,Positive
93,1111111111,m***m,71,Dyson works great! Packaged and delivered perfectly. Thank you!,2024-11-18T07:00:00.000Z,Positive
94,276584812967,t***e,26,"The air purifier arrived quickly and has been working great thus far, seems to be in very good shape as well for a refurbished product. ",2024-11-11T07:00:00.000Z,Positive
95,276584812967,8***t,869,Great item.  Function’s flawless ,2024-10-21T07:00:00.000Z,Positive
96,276584812967,h***9,2,Arrived defective. Incompetent  customer service that stated I have to return the item and wait 15 days so they may determine if it’s eligible for a replacement. Ridiculous timeline given it never worked to begin with.,2024-10-14T07:00:00.000Z,Negative
97,276584812967,g***g,843,"Nice product, quick shipping, Thanks ",2024-10-14T07:00:00.000Z,Positive
98,276584812967,5***8,21302,Please follow the Poke_Garage!,2024-09-30T07:00:00.000Z,Positive
99,276584812967,u***t,1821,All 5 Stars!! Thank you!!,2024-09-30T07:00:00.000Z,Positive
100,276584812967,i***v,108,Great product with app control.  Display is dim but who is looking at it anyway.  (I use the app and voice control with Alexa)  would be 5 stars if the display was as bright as the TP04 and TP10 that I also own,2024-09-23T07:00:00.000Z,Positive
101,276584812967,n***n,191,"Looks New! Everything works perfect, packed very well in generic box. ""Refurbished"" = half price! I'm happy! 😊",2024-09-16T07:00:00.000Z,Positive
102,276584812967,4***j,407,Great Product and Fast Shipping.,2024-09-16T07:00:00.000Z,Positive
103,276584812967,a***a,643,"Excellent seller, super fast shipping, product as described. Highly recommend!",2024-09-09T07:00:00.000Z,Positive
104,276584812967,.***a,60,"Good product, well packaged, like new condition, no scratches or imperfections ",2024-09-02T07:00:00.000Z,Positive
105,276584812967,h***e,181,"Quick shipping, like new condition 
Works excellent ",2024-08-26T07:00:00.000Z,Positive
106,276584812967,n***1,165,"It took longer than usual but it arrived and is perfect. 

Works fine and its already in use. ",2024-08-26T07:00:00.000Z,Positive
107,276584812967,d***x,6,Fast shipment. Product as described.  Have not gone wrong with a Dyson certified refurbished so far.,2024-08-19T07:00:00.000Z,Positive
108,305816030610,n***e,42,As Described. Great seller,2024-10-28T07:00:00.000Z,Positive
109,186293625171,u***u,632,Great seller. Love it!,2024-07-15T07:00:00.000Z,Positive
110,186293625171,4***3,21,Works well as expected. Shipping was super fast and I received earlier than expected. ,2024-06-24T07:00:00.000Z,Positive
111,186293625171,0***i,782,A+,2024-05-13T07:00:00.000Z,Positive
112,186293625171,r***1,597,"CAME IN LOOKING FRESH AND BRAND NEW. MUCH NEEDED ITEM IN ALASKA! FAST SHIPPING, GREAT COMMUNICATION WITH SELLER!",2024-04-15T07:00:00.000Z,Positive
113,314945175197,3***r,397,Thank you it’s awesome love it ￼,2024-01-08T07:00:00.000Z,Positive
114,296631553549,l***t,1894,Excellent Ebay seller.  Quick shipment.  Highly recommended,2024-09-09T07:00:00.000Z,Positive
115,355697968527,2***1,213,"Sadly the Dyson arived damaged from shipping but the seller was beyond amazing and helpful,Great person to buy from and highly recommend ",2024-08-05T07:00:00.000Z,Positive
116,387314014770,s***x,32,"Seller was great at answering questions, prompt shipment and delivery. Item is perfect, would recommend seller !",2024-09-16T07:00:00.000Z,Positive
117,314945475092,c***c,379,eunfuhrabgaben angeben zu hoher zoll,2024-02-05T07:00:00.000Z,Positive
118,256285188879,a***f,10,been a week and works well. in good condition. ,2024-01-29T07:00:00.000Z,Positive
119,204494787893,a***h,7,"Great communication, delivered quickly, thank you!",2024-01-29T07:00:00.000Z,Positive
120,204494787893,2***o,922,Perfect,2024-01-22T07:00:00.000Z,Positive
121,256285188879,a***f,10,been a week and works well. in good condition. ,2024-01-29T07:00:00.000Z,Positive
122,1111111111,a***m,3,"Item in great condition, packaged well ",2024-11-04T07:00:00.000Z,Positive
123,325091233076,5***r,6,Everything went smooth. Product was as stated we love it. Delivery came early.,2023-12-18T07:00:00.000Z,Positive
124,266692754905,r***u,465,Love it! As described. Shipping cost way too high.,2024-06-10T07:00:00.000Z,Positive
125,135092391211,a***s,111,Fast delivery and item came in good condition. Thank you!,2024-09-16T07:00:00.000Z,Positive
126,135092391211,e***n,423,Great item and fast shipping!,2024-09-09T07:00:00.000Z,Positive
127,135092391211,n***v,143,Item arrived in full working condition as described and really fast.,2024-07-29T07:00:00.000Z,Positive
128,1111111111,a***a,7,I was so happy and excited finally I was getting my discontinued Dyson personal purifier.   It was brand new and still intact wrapped in plastic as shown. I read some reviews and very pleased with this seller especially on its fast delivery especially from Japan. ,2024-07-29T07:00:00.000Z,Positive
129,1111111111,p***p,327,No further taxes/MwSt (bought in Germany from Japan). Delivery on exactly the mentioned date. Absolutely new item. Sometimes it's easier to buy around the world then searching in the nearby store....,2024-07-15T07:00:00.000Z,Positive
130,1111111111,e***e,23,everything ok!!!,2024-07-15T07:00:00.000Z,Positive
131,1111111111,o***o,449,This is absolutely perfect. Works on a Canadian outlet and looks perfect. Thank you so much!,2024-07-01T07:00:00.000Z,Positive
132,1111111111,e***v,184,"Arrived earlier than expected. Seller wrapped the item extremely well to prevent damage during shipping.
Product is great size for office.",2024-07-01T07:00:00.000Z,Positive
133,126232147673,1***r,13,Great seller. Item as described. Packed well and received on time.,2024-03-04T07:00:00.000Z,Positive
134,1111111111,r***0,667,Thank you!!,2024-06-24T07:00:00.000Z,Positive
135,314869534427,e***n,43,Ship fast,2024-03-04T07:00:00.000Z,Positive
136,266655244084,m***i,252,"Seller communication skills are not acceptable, seller states he listed this as open box, however open box does not mean one can sell an item as if it is like new, the filter was filthy I don't call this slightly used, the filter was filthy. If an item shows wear then it should be listed as preowned. The seller did not give any details or description of the fan other than a picture and the word open box. He wrote me 5 rude comments, seller should not be allowed to use eBay platform to be abusive",2024-07-15T07:00:00.000Z,Negative
137,186649487567,-***w,264,Great! ,2024-09-23T07:00:00.000Z,Positive
138,186649487567,a***a,643,"Excellent seller, super fast shipping, product as described. Highly recommend!",2024-09-09T07:00:00.000Z,Positive
