,ItemID,CommentingUser,CommentingUserScore,CommentText,CommentTime,CommentType
0,276700866106,o***o,40,"Great! Very strong, light, easy to empty, clean, and more… I love it!",2024-11-18T07:00:00.000Z,Positive
1,276700866106,2***y,85,Great item!  Fast shipping!  Would buy again!,2024-11-11T07:00:00.000Z,Positive
2,276700866106,s***t,5,Very happy customer thank you shipping was very fast,2024-11-11T07:00:00.000Z,Positive
3,276700866106,9***9,2,So far so good! Fast shipping and packaged very well. ,2024-11-11T07:00:00.000Z,Positive
4,276700866106,9***j,83,"Vacuum is good. I love it, but the shipping was a joke. First, they said it will arrive one day late then it arrived 4 days late!",2024-11-11T07:00:00.000Z,Neutral
5,276700866106,r***l,70,Refurb looked brand new.,2024-11-11T07:00:00.000Z,Positive
6,276700866106,n***k,1633,Super seller ,2024-11-11T07:00:00.000Z,Positive
7,276700866106,o***2,212,Thanks for the vacuum. ,2024-11-11T07:00:00.000Z,Positive
8,276700866106,1***4,5,Looks brand new! Quick delivery and great product. Will definitely consider buying again.,2024-11-11T07:00:00.000Z,Positive
9,276700866106,v***n,109,This transaction was super easy. The communication was great. The price was amazing and the delivery was fast. This vacuum cleaner is incredible and powerful but also lightweight. What an investment. I am so happy with this purchase. I would strongly recommend this product and seller.,2024-11-11T07:00:00.000Z,Positive
10,276700866106,p***y,1693,"good product and fair price, fast shipping.",2024-11-11T07:00:00.000Z,Positive
11,276700866106,h***m,5864,Great deal + fast shipping + happy buyer = 5 stars for you!!! ⭐️⭐️⭐️⭐️⭐️,2024-11-11T07:00:00.000Z,Positive
12,276700866106,k***8,466,Ok.,2024-11-11T07:00:00.000Z,Positive
13,276700866106,4***e,170,"Good seller, great price, fast ship
",2024-11-11T07:00:00.000Z,Positive
14,276700866106,d***o,133,stronger than my big dyson from 2010 that still works good,2024-11-04T07:00:00.000Z,Positive
15,276700866106,l***l,830,"As described, looked like new, fast delivery.",2024-11-04T07:00:00.000Z,Positive
16,276700866106,c***e,668,"Thank you!  This is awesome, just as described.  I would highly recommend purchasing from this seller, Dyson.  I know the vacuum was refurbished but it looks nearly brand new. A+++++",2024-11-04T07:00:00.000Z,Positive
17,276700866106,1***2,596,A+service! ,2024-11-04T07:00:00.000Z,Positive
18,276700866106,o***e,33,"Great value! Item arrived quickly and is indistinguishable from new, all at a great price and with a warranty, super satisfied!",2024-11-04T07:00:00.000Z,Positive
19,276700866106,t***w,190,Thank you fast shipping ,2024-11-04T07:00:00.000Z,Positive
20,276700866106,h***a,7,"Came with the full unit, attachments, instructions, and 2 year warranty. Works like new! Picks up cat hair and cat litter very easily.",2024-11-04T07:00:00.000Z,Positive
21,276700866106,o***o,2140,Awesome! Thank you. ,2024-11-04T07:00:00.000Z,Positive
22,276700866106,u***5,131,Super fast shipping came nicely packaged and came with a 2 year warranty can’t beat that ,2024-11-04T07:00:00.000Z,Positive
23,276700866106,c***g,334,Works great! Quick shipping. A++,2024-11-04T07:00:00.000Z,Positive
24,276700866106,b***4,506,Great price very fast shipping great ebayer ,2024-10-28T07:00:00.000Z,Positive
25,276658865411,.***7,53,Exactly as described. Fast shipping. ,2024-11-18T07:00:00.000Z,Positive
26,276658865411,e***s,59,As always Dayson best one,2024-11-18T07:00:00.000Z,Positive
27,276658865411,l***f,20,It was a perfect transaction. I am very satisfied and give a thumbs up to the seller.,2024-11-18T07:00:00.000Z,Positive
28,276658865411,1***7,158,"I've had the vacuum for a week and have used it 2 times. It's amazing! Like brand new. Everything was clean, as if no one ever used it! Suction is great! Very happy with it so far.",2024-11-18T07:00:00.000Z,Positive
29,276658865411,n***t,258,"great product
Like new",2024-11-18T07:00:00.000Z,Positive
30,276658865411,g***s,270,Good value for this price point. ,2024-11-18T07:00:00.000Z,Positive
31,276658865411,s***s,1748,looks good thanks,2024-11-11T07:00:00.000Z,Positive
32,276658865411,9***r,28,"Amazing product, high quality!",2024-11-11T07:00:00.000Z,Positive
33,276658865411,e***1,41,good,2024-11-11T07:00:00.000Z,Positive
34,276658865411,o***n,343,Item was in excellent condition. Works like new. ,2024-11-11T07:00:00.000Z,Positive
35,276658865411,g***d,80,Always happy with the refurbished Dyson vaccuums.,2024-11-11T07:00:00.000Z,Positive
36,276658865411,a***i,1037,Good Product.  Fast delivery ,2024-11-11T07:00:00.000Z,Positive
37,276658865411,s***s,62,Fast delivery.  Product as described.,2024-11-11T07:00:00.000Z,Positive
38,276658865411,j***h,577,Very happy ￼AAA,2024-11-11T07:00:00.000Z,Positive
39,276658865411,d***c,157,Like new,2024-11-11T07:00:00.000Z,Positive
40,276658865411,6***a,178,"Great transaction! Item exactly as described, great price, and fast shipping!",2024-11-11T07:00:00.000Z,Positive
41,276658865411,e***8,328,"Fast shipping. Item received in 2 days from purchase, in good condition and works as it should. Unless any issues arise in the next few months with the refurbed V11 I'd buy another vacuum from them if need be.",2024-11-11T07:00:00.000Z,Positive
42,276658865411,2***9,16,Packaged very well in great condition and works great ,2024-11-11T07:00:00.000Z,Positive
43,276658865411,e***a,37,great,2024-11-11T07:00:00.000Z,Positive
44,276658865411,r***o,843,Arrived earlier than expected. Thank you.,2024-11-11T07:00:00.000Z,Positive
45,276658865411,t***_,243,As described and well priced. Fast shipping,2024-11-11T07:00:00.000Z,Positive
46,276658865411,c***s,237,Good deal. Fast shipping. Repeat customer.,2024-11-11T07:00:00.000Z,Positive
47,276658865411,k***e,105,Works perfectly! Like new... ,2024-11-11T07:00:00.000Z,Positive
48,276658865411,l***8,322,Super fast delivery and great customer service !,2024-11-11T07:00:00.000Z,Positive
49,276658865411,l***e,42,dyson v11. too epic. ,2024-11-11T07:00:00.000Z,Positive
50,276014546170,m***r,896,Thank you!,2024-11-18T07:00:00.000Z,Positive
51,276014546170,c***c,1533,Great item,2024-11-11T07:00:00.000Z,Positive
52,276014546170,v***1,1141,Good Seller With Good Prices & Fast Shipping. A++++,2024-11-11T07:00:00.000Z,Positive
53,276014546170,g***g,109,Excellent communication and fast shipping.  Item exactly as described and arrived in perfect condition:),2024-11-11T07:00:00.000Z,Positive
54,276014546170,a***l,605,I ordered and received the V10 Dyson Animal.  Received it quickly.  Good packaging . But the large sweeper head did not fit my sweeper.  All other attachments fit.  I have contacted the seller 5 xs without any response.  I allowed him several weeks to respond as according to his feedbacks he cooperated well when there was a problem with his products.  So I am surprised and disappointed that he has not contacted me to correct this problem.  my vacuum is useless without the large vacuum head.,2024-11-11T07:00:00.000Z,Negative
55,276014546170,v***s,24,"Charger issue, otherwise good",2024-11-11T07:00:00.000Z,Neutral
56,276014546170,r***z,138,Item was exactly as described and shipped quickly.,2024-11-11T07:00:00.000Z,Positive
57,276014546170,t***r,232,Love it! Works and looks like new!!!,2024-11-11T07:00:00.000Z,Positive
58,276014546170,w***a,253,As expected.  It's a nice vacuum ,2024-11-04T07:00:00.000Z,Positive
59,276014546170,s***m,6,They are presents.  I can't rate them.,2024-11-04T07:00:00.000Z,Neutral
60,276014546170,h***s,41,Great item at a great price. Refurbished but appeared to be brand new.,2024-11-04T07:00:00.000Z,Positive
61,276014546170,y***i,101,Exactly as advertised. Works great and looks brand new. ,2024-11-04T07:00:00.000Z,Positive
62,276014546170,f***c,22,great Seller,2024-11-04T07:00:00.000Z,Positive
63,276014546170,o***1,1236,worked great,2024-11-04T07:00:00.000Z,Positive
64,276014546170,r***t,416,Thanks a lot,2024-11-04T07:00:00.000Z,Positive
65,276014546170,n***c,174,Item as described…quick shipping. ,2024-11-04T07:00:00.000Z,Positive
66,276014546170,a***i,390,Great! Affordable price and fast shipping,2024-11-04T07:00:00.000Z,Positive
67,276014546170,s***a,138,Complicated to assemble.  No assembly info included. Not good. ,2024-11-04T07:00:00.000Z,Positive
68,276014546170,e***7,64,"The purchase was quick and easy,  Bought this one for our son in his new apartment.  
Love these cordless machines.  it's our third V10
Delivered with great packaging and no hassles",2024-10-28T07:00:00.000Z,Positive
69,276014546170,d***a,861,"the only issue is all of the instructions are online would be nice to have a quick start guide

thanks",2024-10-28T07:00:00.000Z,Positive
70,276014546170,i***u,835,"Fast shipping, excellent item.  Looks and works like new.  Thanks!",2024-10-28T07:00:00.000Z,Positive
71,276014546170,p***s,700,excellent refurb...recommend,2024-10-28T07:00:00.000Z,Positive
72,276014546170,a***g,21,"Meets my needs, great battery life, upgrade from my last Dyson vacuum which stopped functioning properly after years of use. ",2024-10-28T07:00:00.000Z,Positive
73,276014546170,r***r,78,It is by far the best cordless vacuum I have EVER owned. I stepped up and got this Dyson and I am so happy that I did.,2024-10-28T07:00:00.000Z,Positive
74,276014546170,2***-,72,"Perfect condition, just as described.",2024-10-28T07:00:00.000Z,Positive
75,276586109808,u***k,10,👍,2024-11-18T07:00:00.000Z,Positive
76,276586109808,i***b,80,"Does the job. Battery definitely could last more than 30 minutes on high but for a small apartment, it works.",2024-10-21T07:00:00.000Z,Positive
77,276586109808,1***4,846,As described ,2024-10-21T07:00:00.000Z,Positive
78,276586109808,d***p,41,As expected. Fast shipping ,2024-10-14T07:00:00.000Z,Positive
79,276586109808,h***r,28,A+,2024-10-14T07:00:00.000Z,Positive
80,276586109808,7***r,285,"Nice vacuum, and great condition.",2024-10-07T07:00:00.000Z,Positive
81,276586109808,a***r,2777,"As  advertised   , Nice working  vac.",2024-10-07T07:00:00.000Z,Positive
82,276586109808,v***i,973,D,2024-10-07T07:00:00.000Z,Positive
83,276586109808,r***e,176,Quick & easy. ,2024-10-07T07:00:00.000Z,Positive
84,276586109808,h***9,39,So far soo good,2024-10-07T07:00:00.000Z,Positive
85,276586109808,r***m,925,"Extremely happy with the purchase, thank you",2024-09-30T07:00:00.000Z,Positive
86,276586109808,d***i,8,I got this vacuum for my parents since they are elderly and they needed something small and light. They are very happy with this product and I am very happy with the seller. We got a reliable product at a good price. Highly recommend! ,2024-09-30T07:00:00.000Z,Positive
87,276586109808,n***n,207,Sent a faulty vacuum so I had to waste time bringing it to the Dyson dealer. They replaced the battery there and now it's fine. ,2024-09-30T07:00:00.000Z,Neutral
88,276586109808,a***a,331,Perfect customer service.,2024-09-23T07:00:00.000Z,Positive
89,276586109808,_***9,96,item came quickly and well packaged. Looks brand new,2024-09-23T07:00:00.000Z,Positive
90,276586109808,u***u,1539,Seems to be like new. ,2024-09-23T07:00:00.000Z,Positive
91,276586109808,h***.,254,Good,2024-09-16T07:00:00.000Z,Positive
92,276586109808,g***t,2251,Great product/great warranty. Thank you!,2024-09-16T07:00:00.000Z,Positive
93,276586109808,m***g,93,Good buy!,2024-09-16T07:00:00.000Z,Positive
94,276586109808,i***i,85,Amazing price for this Dyson! Works perfectly and is like it's brand new. Everything was included except one of the roller bar accessories but that has no impact on what I use it for.,2024-09-16T07:00:00.000Z,Positive
95,276586109808,s***c,8,"Good, as shown",2024-09-09T07:00:00.000Z,Positive
96,276586109808,_***_,311,Item as described. Arrived fast.  Satisfied customer.,2024-09-09T07:00:00.000Z,Positive
97,276586109808,_***_,311,"Item as described, quick shipping.  Very satisfied customer ",2024-09-09T07:00:00.000Z,Positive
98,276586109808,e***u,221,Nice as described and fast shipping.,2024-09-09T07:00:00.000Z,Positive
99,276586109808,p***h,217,"Fast shipping, arrived as described. Thank you! ",2024-09-09T07:00:00.000Z,Positive
100,276717345982,u***i,915,A+,2024-11-18T07:00:00.000Z,Positive
101,276717345982,d***8,189,Great product,2024-11-11T07:00:00.000Z,Positive
102,276717345982,n***t,49,"Item received, in good condition a little dirty. Nonetheless, functional and was ready to go right out the box",2024-11-11T07:00:00.000Z,Positive
103,276717345982,e***a,1791,Super E-BAYER!!! Super fassssst shipper!!!! excellent Dyson sweeper!!!!!,2024-11-11T07:00:00.000Z,Positive
104,276717345982,s***9,25,Nice vacuum…thanks!,2024-11-11T07:00:00.000Z,Positive
105,276717345982,8***s,404,So glad I bought this sweeper. Great bargain. It came just as if I'd bought it for full price at Target. Dyson communicated with me every step of the process from order to delivery and they e-mailed me the warranty this motning. I couldn't be happier with my purchase. THIS is the gold standard of how an eBay purchase should be! A+++,2024-11-04T07:00:00.000Z,Positive
106,276717345982,f***u,233,"Practically brand new , even though it’s refurbished, that’s what factory refurbished gets you",2024-11-04T07:00:00.000Z,Positive
107,276582527279,f***f,405,Good Vacuum.,2024-11-18T07:00:00.000Z,Positive
108,276582527279,o***g,24,fast shipping,2024-11-18T07:00:00.000Z,Positive
109,276582527279,a***e,30,Came in like new condition. Works amazingly. Absolutely loving dyson level of clean!,2024-11-18T07:00:00.000Z,Positive
110,276582527279,e***r,799,Excellent vacuum. Looks brand new. Fast shipping an great communication. Don’t hesitate save yourself some $ buy refurbished.,2024-11-11T07:00:00.000Z,Positive
111,276582527279,w***a,69,Great experience ,2024-11-11T07:00:00.000Z,Positive
112,276582527279,s***s,115,"Great condition and fast shipping, thanks a lot!",2024-11-11T07:00:00.000Z,Positive
113,276582527279,u***b,59,Perfect condition ,2024-11-04T07:00:00.000Z,Positive
114,276582527279,e***b,31,Turns vacuuming from a chore to a thrill.,2024-11-04T07:00:00.000Z,Positive
115,276582527279,9***u,298,Works well.  No issues at the moment.,2024-11-04T07:00:00.000Z,Positive
116,276582527279,o***d,261,Perfect ,2024-11-04T07:00:00.000Z,Positive
117,276582527279,2***j,2,Nice product ,2024-11-04T07:00:00.000Z,Positive
118,276582527279,r***o,201,Item as described.,2024-10-28T07:00:00.000Z,Positive
119,276582527279,r***o,48,One component arrived broken. I took a picture of it and asked for a replacement. They never responded. ,2024-10-28T07:00:00.000Z,Negative
120,276582527279,-***-,716,Phenomenal vacuum. Worth every dollar. Happy to get it refurbished ,2024-10-28T07:00:00.000Z,Positive
121,276582527279,r***c,243,Great experience!,2024-10-21T07:00:00.000Z,Positive
122,276582527279,a***y,581,great vacuum - no issues with delivery or condition,2024-10-21T07:00:00.000Z,Positive
123,276582527279,2***2,239,Great sweeper that looks completely new. I bought the wrong size and the return process was super easy.,2024-10-21T07:00:00.000Z,Positive
124,276582527279,s***a,390,except for a tiny pipe dent every seemed brand new. Works as advertized.,2024-10-21T07:00:00.000Z,Positive
125,276582527279,m***e,145,Thanks A++,2024-10-14T07:00:00.000Z,Positive
126,276582527279,a***s,249,Fast shipper and product was as described ,2024-10-14T07:00:00.000Z,Positive
127,276582527279,e***a,85,This comment has been removed by eBay.,2024-10-14T07:00:00.000Z,Negative
128,276582527279,m***m,1230,Perfect condition and decently fast shipping.,2024-10-14T07:00:00.000Z,Positive
129,276582527279,a***d,11,Working well. ,2024-10-14T07:00:00.000Z,Positive
130,276582527279,k***k,52,The item came damaged so I contacted the seller for an exchange. They never responded to me. The description said like new certified refurbished but there was wear and tear on the items. Not recommended this seller. ,2024-10-07T07:00:00.000Z,Negative
131,276582527279,e***m,540,Shipping damage. Seller won’t respond. ,2024-10-07T07:00:00.000Z,Negative
132,286066540592,r***t,2222,got it,2024-10-28T07:00:00.000Z,Positive
133,286066540592,g***o,1490,A+++,2024-10-28T07:00:00.000Z,Positive
134,286066540592,a***r,55,"Had an issue with this item, but the seller was able to resolve my issue and allowed me to return for a full refund.",2024-10-21T07:00:00.000Z,Neutral
135,286066540592,x***s,730,Thanks 🙏🏻 ,2024-10-07T07:00:00.000Z,Positive
136,276618777412,s***b,245,I'm pretty sure this was brand new... I love it!!! Thank you!!,2024-11-11T07:00:00.000Z,Positive
137,276618777412,7***o,240,"Excellent condition, thanks. ",2024-11-11T07:00:00.000Z,Positive
138,276618777412,e***c,125,"Item was as described. I was able to register the vacuum on Dyson’s website and got a warranty through Dyson themselves. I was mistakenly sent a charger for a V8 model instead of the correct V15 charger, but Dyson support were able to help me (they won’t answer eBay messages, instead you should register your product and go through Dyson support). Fantastic product in fantastic condition!",2024-11-11T07:00:00.000Z,Positive
139,276618777412,7***c,175,Item arrived in perfect condition in the original boxes.,2024-11-11T07:00:00.000Z,Positive
140,276618777412,g***a,811,As described ,2024-11-11T07:00:00.000Z,Positive
141,276618777412,n***m,750,Thanks!  Quick delivery and product looks great.,2024-11-11T07:00:00.000Z,Positive
142,276618777412,1***o,153,Item in good condition. Fast sbipping. ,2024-11-11T07:00:00.000Z,Positive
143,276618777412,2***1,192,"Defective out of the box, i contacted Dyson immediately, they said it needs a new main body but they can’t help since I bought it on eBay. Waiting for the Dyson eBay store to respond…doesn’t make sense why I can’t contact Dyson for the official warranty. Was a big mistake wasting time with a Dyson refurbished product.",2024-10-28T07:00:00.000Z,Negative
144,276618777412,b***b,100,Had Dyson not put on the webpage that this item was refurbished? I honestly don’t know if I could’ve told the difference between this refurbish model a brand new one the dustbin was extremely cleaned. All parts had no damages or necks or scratches and it works extremely well could not be more pleased!,2024-10-21T07:00:00.000Z,Positive
145,276618777412,0***p,10,"It feels like you are playing real life, Luigi‘s mansion. This vacuum is awesome.",2024-10-21T07:00:00.000Z,Positive
146,276618777412,7***4,3,"Scored this when Dyson was still offering them at a hood price.  Machine cannot be told from new, and operates accordingly.  Very pleased with the machine and Dyson (this time...buying a refurb for ~$50 less than new is not a bargain).  ",2024-10-21T07:00:00.000Z,Positive
147,276618777412,e***5,3,Product as described,2024-10-14T07:00:00.000Z,Positive
148,276618777412,e***v,455,"Fast shipping and perfect Dyson V15 Detect Absolute Cordless vacuum! My refurbished unit did not look used at all. However, the inner ring that holds the red rubber gasket seems a little bit off... As in it's not clipped in all the way. That was the problem with my previous Dyson, but this vacuum is really good at cleaning up all the pet hair from my carpets that I would just buy another canister if needed.",2024-10-14T07:00:00.000Z,Positive
149,276618777412,n***l,14,"Shipping was fast, and item was practically brand new.",2024-10-14T07:00:00.000Z,Positive
150,276618777412,r***h,768,Perfect!,2024-10-14T07:00:00.000Z,Positive
151,276618777412,1***d,132,Vacuum looks and functions as new. It removed so much dust from surfaces that looked pristine. Highly recommend both the vacuum and the seller. PS: The green laser light on this vacuum is a great feature.,2024-10-14T07:00:00.000Z,Positive
152,276618777412,a***i,96,"Easy buy, working as intended.",2024-10-14T07:00:00.000Z,Positive
153,276618777412,c***h,29,Great!,2024-10-14T07:00:00.000Z,Positive
154,276618777412,e***r,81,"Just like new , perfect conditions ",2024-10-07T07:00:00.000Z,Positive
155,276618777412,v***p,5722,Super Seller,2024-10-07T07:00:00.000Z,Positive
156,276618777412,e***l,1198,Exactly as described and shipped fast. Works perfectly.,2024-10-07T07:00:00.000Z,Positive
157,276618777412,i***l,213,"Quick delivery, as described. ",2024-10-07T07:00:00.000Z,Positive
158,276618777412,c***s,27,"Great vacuum, lives up to Dyson brand name. ",2024-10-07T07:00:00.000Z,Positive
159,276618777412,s***o,7,"This is the Ferrari of vacuums. Easily the best vacuum I’ve ever used. A session with it feels like playing a video game, as the laser reveals hidden dust and the vacuum increases power as it hits areas with more dust. Using it is a highlight of my day, not kidding. It’s versatile and so fast. Epic epic vacuum .",2024-09-30T07:00:00.000Z,Positive
160,276618777412,2***o,1,absolutely perfect! Arrived on time beautifully packaged and everything in pristine condition! I couldn't believe it. So far it works perfectly! I'll try and update once I've used it for a while,2024-09-30T07:00:00.000Z,Positive
161,276619332081,e***o,653,Received with a broken wheel.  Was able to return it and get refunded. ,2024-11-11T07:00:00.000Z,Neutral
162,276619332081,l****,244,Wonderful transaction. Thank you ,2024-11-04T07:00:00.000Z,Positive
163,276619332081,m***m,17,"Packaged great, works well",2024-11-04T07:00:00.000Z,Positive
164,276619332081,o***o,1284,Highly recommend,2024-10-28T07:00:00.000Z,Positive
165,276619332081,5***8,661,Very fast shipping and in perfect condition! Thank you!,2024-10-28T07:00:00.000Z,Positive
166,276619332081,i***b,458,Fast shipment- A++++,2024-10-28T07:00:00.000Z,Positive
167,276619332081,n***y,336,"I really cannot tell that it’s been refurbished. I had to look up the user manual to figure out how to put it together because it didn’t come with one, but otherwise it works great would definitely recommend. ￼",2024-10-28T07:00:00.000Z,Positive
168,276619332081,w***d,182,5 *****,2024-10-21T07:00:00.000Z,Positive
169,276619332081,3***1,1628,Thanks,2024-10-21T07:00:00.000Z,Positive
170,276619332081,2***0,1314,"Just as described, thank you.",2024-10-21T07:00:00.000Z,Positive
171,276619332081,2***0,1314,"Just as described, thank you.",2024-10-21T07:00:00.000Z,Positive
172,276619332081,9***9,235,Great Vaccume. Fast shipping well packaged ,2024-10-14T07:00:00.000Z,Positive
173,276619332081,s***6,317,Just like new. Works great!  ,2024-10-14T07:00:00.000Z,Positive
174,276619332081,5***2,133,Exactly as described. ,2024-10-14T07:00:00.000Z,Positive
175,276619332081,b***4,222,👍 ,2024-10-14T07:00:00.000Z,Positive
176,276619332081,k***r,250,Less then month i brought this vacuum it started get acting rear will cut off sometimes can't vacuum either ,2024-10-14T07:00:00.000Z,Neutral
177,276619332081,e***l,468,"Had a few things missing, but they made it  right.  I would buy from them again. ",2024-10-14T07:00:00.000Z,Positive
178,276619332081,c***l,49,Absolutely perfect! Hurray! 🌞🎃,2024-10-14T07:00:00.000Z,Positive
179,276619332081,k***t,301,"Great deal, fast shipping!! ",2024-10-07T07:00:00.000Z,Positive
180,276619332081,n***1,1296,Fast shipping.  Great seller,2024-10-07T07:00:00.000Z,Positive
181,276619332081,l***q,85,Quick delivery. Works great. ,2024-10-07T07:00:00.000Z,Positive
182,276619332081,5***5,100,The vacuum never worked. It was broke right out of the box. $$$ just thrown away,2024-10-07T07:00:00.000Z,Negative
183,276619332081,s***s,926,Great seller! 5 stars.,2024-10-07T07:00:00.000Z,Positive
184,276619332081,2***3,43,"Works very well, can’t even tell it was refurbished. Very easy to put together. Fairly easy to use and not very heavy. Awesome product and I do hope it continues to last me for a very long time. ",2024-10-07T07:00:00.000Z,Positive
185,276619332081,0***5,10,Wife loved it,2024-10-07T07:00:00.000Z,Positive
186,276637788522,z***0,1098,"Love the vacuum, quick delivery",2024-11-18T07:00:00.000Z,Positive
187,276637788522,5***d,13196,Perfect transaction. Thank you ,2024-11-18T07:00:00.000Z,Positive
188,276637788522,r***e,201,Looks and operates like it's brand new!  Quick delivery!,2024-11-11T07:00:00.000Z,Positive
189,276637788522,t***a,3,No complaints! Works fine and looks like new.,2024-11-11T07:00:00.000Z,Positive
190,276637788522,7***2,211,"Post saying products condition is certified “like new”, however the vacuum I received had multiple scratches and broken bin handle. Contacting Seller on Ebay was waste of time, no reply there. Contacting Dyson customer support was back and forth refusing to make a return. Agreeing on sending a broken part, but discovering it out of stock. Offering an exchange for another refurbished vacuum, but the 6m warranty start date would not change. Thanks to Ebay they helped to resolve this problem! ",2024-11-11T07:00:00.000Z,Negative
191,276637788522,y***6,280,Shipping was quick. Great product thank you.,2024-11-11T07:00:00.000Z,Positive
192,276637788522,p***t,159,"Item arrived in a timely manner. Refurbished product was well packaged and showed no signs of use, wear and tear. Operated just fine and is backed by a warranty. Thank you!",2024-11-11T07:00:00.000Z,Positive
193,276637788522,g***a,525,Works Great,2024-11-11T07:00:00.000Z,Positive
194,276637788522,s***c,397,My vacuum was delivered damaged and have reached out to the seller multiple times as the sticker came bent and all I asked for was for it to be replaced. I DO NOT recommend them as they don’t back up their products. ,2024-11-04T07:00:00.000Z,Negative
195,276637788522,9***2,219,Great vacuum! Good as new and I saved a lot of money. ,2024-11-04T07:00:00.000Z,Positive
196,276637788522,k***k,620,Great ebayer,2024-11-04T07:00:00.000Z,Positive
197,276637788522,c***m,1335,All good,2024-11-04T07:00:00.000Z,Positive
198,276637788522,l***a,335,"The product was as described, received promptly, and was well packaged. ",2024-10-28T07:00:00.000Z,Positive
199,276637788522,h***h,40,Great,2024-10-28T07:00:00.000Z,Positive
200,276637788522,m***m,758,Great thanks,2024-10-28T07:00:00.000Z,Positive
