,ItemID,CommentingUser,CommentingUserScore,CommentText,CommentTime,CommentType
399,276583570449,h***t,122,Very quick shipment and 100% as described. Very satisfied.,2024-09-09T07:00:00.000Z,Positive
400,276583570449,p***l,3073,good,2024-09-09T07:00:00.000Z,Positive
401,276583570449,o***s,318,"Very Happy with my purchase,  my old Dyson finally died and wanted another one. Great price and fast shipping..",2024-09-09T07:00:00.000Z,Positive
402,276583570449,e***e,179,💯👌,2024-09-02T07:00:00.000Z,Positive
403,276583570449,g***7,105,"I've had the same exact model with all the attachments for 5 years. I have a smaller house, so the battery life is okay for my needs and not worth paying almost double for the latest and greatest models. We needed an extra for our guest house. My daughter has had the same model  for 4 years. The battery charging: IMHO, it is best not to leave it plugged in continuously, and estimate 90 percent, like your smartphones.
As for the vacuum; it sucks well! Keep it clean.
Oh, too much email updates!",2024-09-02T07:00:00.000Z,Positive
404,276583570449,a***a,998,thankyou,2024-08-12T07:00:00.000Z,Positive
405,305572025572,o***d,87,Fast shipping. Item was in better shape than described. Great deal!,2024-10-21T07:00:00.000Z,Positive
406,305572025572,z***h,39,Thank you !,2024-10-21T07:00:00.000Z,Positive
407,305572025572,4***8,4,"Although listing stated item might be very used, item actually appeared to be closer to gently used. Have been using item since delivered, vacuum seems to be functioning well. No issues.  Great price, great vacuum. ",2024-10-07T07:00:00.000Z,Positive
408,305572025572,t***t,258,The package came very well package. I was surprised that the description read very used. But the item came looking barely used. Great value easy to say if buy form this person again. ,2024-06-03T07:00:00.000Z,Positive
409,256428405622,a***s,210,Great A+++,2024-09-23T07:00:00.000Z,Positive
410,285456487627,i***7,4,"The shipping was fast, and the vacuum was in good shape and clean!",2024-06-03T07:00:00.000Z,Positive
411,285456487627,g***0,1219,Very nice ,2024-02-19T07:00:00.000Z,Positive
412,285470118101,r***t,638,Great Ebayer ,2024-11-11T07:00:00.000Z,Positive
413,285470118101,h***a,1,I had a small issue with one of the parts and the seller rectified it immediately. I had a replacement part within two days. The device works better than expected and this whole experience was incredibly pleasant.,2024-02-12T07:00:00.000Z,Positive
414,285470118101,l***1,2335,Thanks for everything ,2023-11-20T07:00:00.000Z,Positive
415,125949962102,r***t,76,Average condition item- there was a crack on the battery pack. ,2024-10-28T07:00:00.000Z,Neutral
416,125949962102,a***m,252,"  Nice, battery good , runs good, strong suction. Happy with purchase …….",2024-09-30T07:00:00.000Z,Positive
417,125949962102,o***o,358,Great product and fast delivery. ,2024-01-22T07:00:00.000Z,Positive
418,176463765581,a***q,48,Everything was in here. Packaging was just a little sketchy. Box was torn and sorta open when arrived. But it all works!,2024-11-11T07:00:00.000Z,Positive
419,156438766451,r***m,664,as per add,2024-10-28T07:00:00.000Z,Positive
420,156438766451,h***k,85,The ￼item came on time and was like new. Runs perfectly.,2024-10-28T07:00:00.000Z,Positive
421,156438766451,_***e,3,"We were a bit nervous about buying an open box item as we had not done so before. When it arrived we were very happy to see we had nothing to worry about. The vacuum was new, all the parts were there and it was in the original (slightly damaged) box. The seller,  Bybristolbay , delivered exactly as promised. I would definitely buy from them again. And, we love the vacuum…every pet owner should have one! ",2024-10-21T07:00:00.000Z,Positive
422,285932521020,0***1,568,Item just as described and great response to one issue I had. Would definitely buy from again,2024-07-22T07:00:00.000Z,Positive
423,285790000939,2***0,3541,"Flawless Transaction, Thanks",2024-08-12T07:00:00.000Z,Positive
424,285790000939,j***m,4017,Powerful! Like new,2024-07-15T07:00:00.000Z,Positive
425,405187394216,r***s,291,Fast shipping and item as described. ,2024-11-11T07:00:00.000Z,Positive
426,285779714771,e***g,16,Top seller. Item arrived well packaged. Tested it right out of the box and it worked fine. ,2024-09-23T07:00:00.000Z,Positive
427,285779714771,9***9,977,Fantastic vacuum!  Quickly shipped & well wrapped. Thank you for great value!!!  5 Stars ⭐️ ,2024-09-23T07:00:00.000Z,Positive
428,285779714771,s***7,63,The vacuum is exactly as described. Thanks.,2024-09-16T07:00:00.000Z,Positive
429,285779714771,o***o,58,Would work with again.,2024-08-26T07:00:00.000Z,Positive
430,285779714771,t***s,1538,Excellent item!,2024-04-29T07:00:00.000Z,Positive
431,285779714771,e***s,402,"Great customer service. Despite having an issue with my order,  the seller and I worked on a solution until we were both satisfied. The vacuum works great, too! Thanks!",2024-04-08T07:00:00.000Z,Positive
432,285779714771,i***0,36,RedFox Group is a no B.S. extremely efficient seller. Item was exactly as described. Item was sent immediately. This is a very strong seller. Extremely happy. THANKS GUYS. Your execution was noticed. ,2024-03-25T07:00:00.000Z,Positive
433,311926342336,e***k,908,"As Described and quick shipping.  For a used unit, this looks and functions as brand new!  Love it! A++++",2024-01-01T07:00:00.000Z,Positive
434,305745149320,_***8,1,"I received the vacuum literally in days after ordering! The seller was transparent about the damage to the product box prior to purchase and upon inspection on arrival, no damage to the vac was found. Have used it many times since I received it and am very happy with the results.",2024-11-11T07:00:00.000Z,Positive
435,286098170708,2***i,21,Works great!  Like new!  Thank you.,2024-11-18T07:00:00.000Z,Positive
436,286098170708,k***c,120,This vacuum arrived early and worked great.  I would buy from this seller again. ,2024-11-18T07:00:00.000Z,Positive
437,286098170708,m***s,25,perfect.,2024-11-11T07:00:00.000Z,Positive
438,286098170708,h***a,2796,Got here fast! Many thanks ,2024-11-11T07:00:00.000Z,Positive
439,286098170708,s***a,501,"Perfect condition as described, thank you so much!",2024-11-11T07:00:00.000Z,Positive
440,286098170708,0***9,39,"I have only used it once so far and I really like it.
It picked up dog hair on the wood floor and on shag carpet.
It is light enough to handle easily but it has enough weight that you can maneuver it anywhere; under beds, behind sofas, etc.",2024-11-11T07:00:00.000Z,Positive
441,286098170708,7***7,1485,"Aside from battery life, this is a good product. ",2024-11-11T07:00:00.000Z,Positive
442,286098170708,a***t,317,thank you!!,2024-11-11T07:00:00.000Z,Positive
443,286098170708,o***8,10,Thanks!,2024-11-11T07:00:00.000Z,Positive
444,286098170708,c***c,422,I love my new toy! Great service!,2024-11-11T07:00:00.000Z,Positive
445,286098170708,m***g,1,"Not in the box pictured, wasn’t sure if it’s the vacuum Dyson V8 as there are no markings on vacuum or box. Runs great though and seems to do the job. ",2024-11-04T07:00:00.000Z,Positive
446,286098170708,d***o,224,A+ seller!,2024-10-28T07:00:00.000Z,Positive
447,286098170708,r***e,135,Dyson vac is great!  And can’t beat the price. Thanks!!,2024-10-28T07:00:00.000Z,Positive
448,286098170708,s***e,505,Great deal love this vacuum thank you soooooooo much!!!!!!,2024-10-28T07:00:00.000Z,Positive
449,286098170708,t***2,450,from communication down to prompt delivery of this Dyson handheld I am extremely happy with this purchase from a really terrific seller!,2024-10-21T07:00:00.000Z,Positive
450,286098170708,r***z,222,Good looking tool! Thanks,2024-10-21T07:00:00.000Z,Positive
451,286098170708,r***s,822,We're very happy with this seller.  Fast shipping and great communications.  The vacuum works as it should.  We will not hesitate to buy from this seller again.  5 stars!,2024-10-21T07:00:00.000Z,Positive
452,286098170708,a***w,75,Item as described. All parts included. Installed and checked. Works great. Shipped promptly. ,2024-10-21T07:00:00.000Z,Positive
453,286098170708,1***9,299,Item arrived as advertised.  Very nice.  Thanks!,2024-10-21T07:00:00.000Z,Positive
454,305369013419,o***k,2021,A+++++++++++++++++++++++++++++++++++++++++++++,2024-10-07T07:00:00.000Z,Positive
455,305369013419,s***l,70,Item was as described! Everything was still in original box. Would purchase again. ,2024-08-19T07:00:00.000Z,Positive
456,305369013419,9***c,189,Had a problem with a battery and the seller responded within minutes and then shipped me a new battery within a couple days. It was very positive experience.,2024-04-01T07:00:00.000Z,Positive
457,305369013419,r***8,286,"Good condition, prompt service! Highly recommend",2024-02-05T07:00:00.000Z,Positive
458,285932337878,3***1,2746,Perfect ,2024-11-11T07:00:00.000Z,Positive
459,167018249237,a***_,1,Item was brand new in the box as stated. GEN5 dyson absolute detect works great. Great seller. Good buyer experience answered questions promptly. ,2024-10-28T07:00:00.000Z,Positive
460,167018249237,s***e,756,Great seller. Thank you,2024-10-14T07:00:00.000Z,Positive
461,305821650805,e***a,480,Great purchase! Easy transaction. Shipped quickly. Well packaged. This Dyson works great & looks brand new- much less expensive than buying new!,2024-11-11T07:00:00.000Z,Positive
462,285821633305,r***r,39,Item was great and arrived quickly,2024-10-28T07:00:00.000Z,Positive
463,285821633305,7***c,1280,"Item works well! Very dirty however. I know it’s a vacuum and all, but it was a gross sight to say the least.",2024-09-30T07:00:00.000Z,Positive
464,285821633305,9***p,898,Item was as described and works well.,2024-09-16T07:00:00.000Z,Positive
465,285821633305,r***i,314,"Great item that was exactly as described and shipped out very timely., Not much left to be desired from an eBay purchase. Thank you!",2024-08-19T07:00:00.000Z,Positive
466,285821633305,6***8,225,Fast delivery. Good price. I'm very happy with item,2024-08-12T07:00:00.000Z,Positive
467,286026450528,7***n,59,Excellent communication and made right when one of the components was not working and sent another one. Would definitely purchase from them again! ,2024-10-21T07:00:00.000Z,Positive
468,276436443013,n***v,440,👍,2024-10-14T07:00:00.000Z,Positive
469,276436443013,c***g,141,"It had an odd smell, but this has gone away with use.",2024-09-30T07:00:00.000Z,Positive
470,276436443013,o***e,888,Great e-Seller. Fast shipping! Highly recommended!,2024-08-12T07:00:00.000Z,Positive
471,276436443013,o***e,911,Great,2024-06-03T07:00:00.000Z,Positive
472,276388637635,g***h,141,"A++++ , item is exactly as describe and in working perfect condition , this seller is fantastic to work with customer service is A+ had an issue with the wall mount and with no hassle they send me a brand new one so definitely will shop here again.",2024-06-10T07:00:00.000Z,Positive
473,276388637635,0***p,18,Great deal,2024-04-15T07:00:00.000Z,Positive
474,285791109505,e***a,281,Thanks ,2024-09-30T07:00:00.000Z,Positive
475,285791109505,7***e,578,Works great! I’ve tried em all and I come back to Dyson every time. Thanks!,2024-09-30T07:00:00.000Z,Positive
476,285791109505,v***f,851,Very fast delivery and dyson vacuum in like   new condition! Very satisfied!,2024-07-29T07:00:00.000Z,Positive
477,304782686163,3***3,631,Easy transaction!,2024-09-16T07:00:00.000Z,Positive
478,304782686163,t***l,681,"Great item and smooth transaction, thank you.",2024-09-09T07:00:00.000Z,Positive
479,304782686163,4***w,5,"Vacuum showed up in amazing shape with all attachments, not dirty at all!",2024-08-05T07:00:00.000Z,Positive
480,304782686163,8***u,264,Very honest seller and trustworthy 😊,2024-07-15T07:00:00.000Z,Positive
481,304782686163,i***e,205,very new,2024-06-17T07:00:00.000Z,Positive
482,304782686163,n***6,490,"Perfect transaction, same day ship and better condition than expected.",2024-06-10T07:00:00.000Z,Positive
483,304782686163,f***r,50,Item was in excellent condition. Way better than expected. Shipped quick. Overall great experience. 👍,2024-05-27T07:00:00.000Z,Positive
484,304782686163,4***3,399,"Absolutely THE BEST. Was expecting used and dirty but it arrived like new open box, clean inside box, ready to work.
Come with High Torque Head, Laser Flurry Head, Screw Hair Head and others also Mounting Bracket, 2 Batteries and 2 Chargers, All inside original package.
Function as expecting.
Excellent. Received my 2 years warranty after registering Dyson Website.",2024-05-20T07:00:00.000Z,Positive
485,304782686163,n***3,270,great! just as described,2024-05-13T07:00:00.000Z,Positive
486,304782686163,t***u,1020,WOW!! Item was like NEW and this seller is like buying form family!! Awesome all the way!! Thank you A +++++++,2024-05-13T07:00:00.000Z,Positive
487,304782686163,t***u,1020,WOW!! Item was like NEW and this seller is like buying form family!! Awesome all the way!! Thank you A +++++++ ,2024-05-13T07:00:00.000Z,Positive
488,304782686163,m***0,130,I appreciate your quick response with replacement torque head when our initial one failed right away. Thank you again,2024-04-01T07:00:00.000Z,Positive
489,304782686163,p***b,249,Fast and accurate ,2024-03-18T07:00:00.000Z,Positive
490,304782686163,5***s,858,"Very fast shipping, item is an excellent condition/good price",2024-03-04T07:00:00.000Z,Positive
491,304782686163,e***s,152,great,2024-02-26T07:00:00.000Z,Positive
492,304782686163,e***s,152,great,2024-02-26T07:00:00.000Z,Positive
493,304782686163,e***s,152,great,2024-02-26T07:00:00.000Z,Positive
494,304782686163,e***s,152,great,2024-02-26T07:00:00.000Z,Positive
495,304782686163,e***s,152,great to work with,2024-02-26T07:00:00.000Z,Positive
496,304782686163,0***s,72,Great seller. No need to worry about surprises.,2024-01-01T07:00:00.000Z,Positive
497,304782686163,e***s,152,good product,2023-12-11T07:00:00.000Z,Positive
498,304782686163,7***x,57,Accurate discription!,2023-12-04T07:00:00.000Z,Positive
499,285787023142,3***3,3246,Second one I’ve bought from this seller. A+,2024-10-07T07:00:00.000Z,Positive
500,285787023142,a***d,9,Item came on time and “in new condition”.  Great deal!,2024-08-05T07:00:00.000Z,Positive
501,285787023142,3***3,3246,I love it.,2024-07-01T07:00:00.000Z,Positive
502,285787023142,2***h,30,Works ok. Something is going on with filter . ,2024-06-10T07:00:00.000Z,Neutral
503,285787023142,2***h,3852,worked out,2024-05-06T07:00:00.000Z,Positive
504,285787023142,m***y,586,Great seller and fast shipping! Also extremely good communication!,2024-04-22T07:00:00.000Z,Positive
505,395300144651,y***y,50,Exactly as described and best price I could find online. ,2024-10-14T07:00:00.000Z,Positive
506,395300144651,k***f,494,A perfect transaction in all respects!,2024-07-15T07:00:00.000Z,Positive
507,285850127016,-***u,43,All good…works as stated,2024-09-16T07:00:00.000Z,Positive
508,285850127016,h***b,310,Item arrived in great condition and well packaged. Works great,2024-08-26T07:00:00.000Z,Positive
509,285850127016,t***3,402,Excellent vacuum and prompt delivery.,2024-08-12T07:00:00.000Z,Positive
510,285850127016,t***e,437,Exactly as show in the Pictures. 5 out of 5 Stars. Well packaged & quick delivery. Professional eBay Seller.,2024-07-15T07:00:00.000Z,Positive
511,405293338713,j***2,84,Need to send back to Dyson to fix. ,2024-11-04T07:00:00.000Z,Neutral
512,326187825783,e***l,264,As advertised,2024-10-28T07:00:00.000Z,Positive
513,326187825783,l***m,11,"Experience was smooth. Shipping was fast. Product is in excellent condition for a used item. Haven't used it a lot since arriving, seems to work great.",2024-09-23T07:00:00.000Z,Positive
514,276555701210,4***d,56,Thumbs up.,2024-10-21T07:00:00.000Z,Positive
515,276555701210,g***s,130,Excellent tool. Came quickly.,2024-10-21T07:00:00.000Z,Positive
516,276555701210,i***n,33,Works as advertised at a great cost.,2024-10-14T07:00:00.000Z,Positive
517,276555701210,m***6,188,"Fast shipping, as advertised, like new. ",2024-10-14T07:00:00.000Z,Positive
518,276555701210,t***3,97,Everything as expected.,2024-10-07T07:00:00.000Z,Positive
519,276555701210,6***9,86,Very happy with this vacuum!,2024-10-07T07:00:00.000Z,Positive
520,276555701210,9***2,31,Dyson was shipped and received quickly. Well packed. Lots of attachments with no instructions on how to use them. I enjoy the ease of using this sweeper because it is so lightweight. ,2024-09-30T07:00:00.000Z,Positive
521,276555701210,4***2,14,Great experience. Love the vacuum,2024-09-30T07:00:00.000Z,Positive
522,276555701210,s***a,227,excellent transaction,2024-09-23T07:00:00.000Z,Positive
523,276555701210,l***e,452,looks and works as new ,2024-09-23T07:00:00.000Z,Positive
524,276555701210,s***s,59,Perfect vaccuum,2024-09-23T07:00:00.000Z,Positive
525,276555701210,a***_,103,"Great vacuum, great price. No problems so far. Slight cosmetic imperfection but otherwise looks and run like new. ",2024-09-23T07:00:00.000Z,Positive
526,276555701210,6***t,6,The product stopped working within three weeks and the seller is unresponsive to my requests for help.,2024-09-23T07:00:00.000Z,Negative
527,276555701210,h***h,128,"The package arrived fine but the extension wand is dented. The seller initially agreed to replace the wand in 2-3 week or issue partial refund. After 4 weeks of waiting, the seller never responded now.",2024-09-23T07:00:00.000Z,Negative
528,276555701210,l***s,482,Item as described. Fast shipping 👍✅,2024-09-23T07:00:00.000Z,Positive
529,276555701210,e***n,30,"Came as described, fairly clean for being refurbished. Shipped quickly.",2024-09-16T07:00:00.000Z,Positive
530,276555701210,r***8,666,So far so good. The vacuum works beautifully and comes with nice accessories. It’s light weight and the green light on the fluffy brush is neat. I am really happy that I bought it refurbished. It looks and feels like it’s new. ,2024-09-16T07:00:00.000Z,Positive
531,276555701210,s***w,1756,"Nice vacuum, looks new, works well. Perhaps battery doesn’t hold as much of a charge as if it were new ",2024-09-16T07:00:00.000Z,Positive
532,276555701210,r***s,58,Excellent product and shipping. Can't tell the item is refurbished,2024-09-16T07:00:00.000Z,Positive
533,276555701210,n***2,18,Очень хороше качество.,2024-09-16T07:00:00.000Z,Positive
534,276555701210,r***l,125,Great vacuum at a great price!,2024-09-16T07:00:00.000Z,Positive
535,276555701210,m***n,11,"The item arrived over a week past the estimated delivery time at the time I placed the order. It arrived with a part broken, and it has taken two weeks of messaging with the seller for them to tell me that the broken piece is out of stock and not expected for 2-3 weeks. ",2024-09-16T07:00:00.000Z,Negative
536,276555701210,_***u,241,Love that the power button stays on when pressed and not have to hold it on,2024-09-16T07:00:00.000Z,Positive
537,276555701210,b***i,442,"Very cool unit for a very good price. Like a good vacuum cleaner it really sucks ( old joke, but still relevant )￼",2024-09-09T07:00:00.000Z,Positive
538,276555701210,5***5,101,"Really useful, vacuuming is simple and clean",2024-09-09T07:00:00.000Z,Positive
539,393999413476,8***j,2,"It is a gift for my granddaughter.
She has a new vehicle.",2024-11-11T07:00:00.000Z,Positive
540,393999413476,c***-,1,The item was not what I expected but the seller was very responsive and easy to work with to get the issue resolved. I do recommend this seller.,2024-11-04T07:00:00.000Z,Positive
541,393999413476,b***1,2496,Perfect. Thank you!!!,2024-10-07T07:00:00.000Z,Positive
542,393999413476,m***7,152,Item as described. Fast delivery. ,2024-09-02T07:00:00.000Z,Positive
543,393999413476,r***p,102,"Great seller, item received as described",2024-06-10T07:00:00.000Z,Positive
544,393999413476,v***e,1636,awesome smooth fast transaction,2024-04-29T07:00:00.000Z,Positive
545,393999413476,9***k,91,Thanks!,2024-02-12T07:00:00.000Z,Positive
546,393999413476,1***h,114,Great communication- fast delivery,2024-01-22T07:00:00.000Z,Positive
547,393999413476,w***e,33,Exactly as advertised.  Perfect quality.  Shipped early and to cost.  This is a new product although it did not come in factory packaging.  Excellent transaction.,2024-01-08T07:00:00.000Z,Positive
548,393999413476,5***9,137,Thanks for a fast and easy transaction!  No problems—-A+++  It’s just what I wanted!,2024-01-01T07:00:00.000Z,Positive
549,393999413476,e***e,2,prompt delivery,2023-11-20T07:00:00.000Z,Positive
550,286157898472,c***c,422,Excellent seller.  This is my second Dyson purchased from this seller.  I couldn't be more satisfied. ,2024-11-18T07:00:00.000Z,Positive
551,156351905506,j***z,343,Vacuum arrived in perfect condition. Seller was prompt and very easy to do business with. A+ ,2024-10-07T07:00:00.000Z,Positive
552,1111111111,e***7,205,Great buy! Awesome communication! Thank you!,2024-02-26T07:00:00.000Z,Positive
553,1111111111,u***j,20,It was exactly what I expected and got my stuff on time,2024-02-19T07:00:00.000Z,Positive
554,1111111111,a***a,1253,"Good shipping ,instructions kinda weird don’t understand nothing about trigger instructions ",2023-12-25T07:00:00.000Z,Positive
555,355674712974,o***e,322,Just as described!!,2024-11-11T07:00:00.000Z,Positive
556,355674712974,s***s,30,New and in new condition,2024-11-04T07:00:00.000Z,Positive
557,355674712974,e***c,1,"Ship was fast per my request and the seller was kind enough to do it the same day I purchased. I'll definitely buy from this seller again . Product is as describe , I had what a thought a problem with the vacuum but Dyson customer service was able to fix it . ",2024-11-04T07:00:00.000Z,Positive
558,355674712974,5***t,18,I received the vacuum on time and it works wonderfully.,2024-09-09T07:00:00.000Z,Positive
559,355674712974,e***l,1060,Thank you!,2024-09-09T07:00:00.000Z,Positive
560,355674712974,a***a,218,As advertised,2024-07-29T07:00:00.000Z,Positive
561,234941178743,e***a,518,Item as described,2024-10-14T07:00:00.000Z,Positive
562,234941178743,i***_,67,Thank you thank you thank you! This thing has so much power! I thought I had clean carpets until this thing got here! ,2024-09-09T07:00:00.000Z,Positive
563,234941178743,l***3,100,Great communication ,2024-08-12T07:00:00.000Z,Positive
564,234941178743,s***i,129,Right on time!,2024-08-12T07:00:00.000Z,Positive
565,234941178743,o***6,102,Item was like new. This was a great deal! Everything works great and have had no issues at all!,2024-08-05T07:00:00.000Z,Positive
566,234941178743,o***m,84,The battery stopped charging after 3 uses. I would like to request a new battery please ,2024-07-22T07:00:00.000Z,Positive
567,234941178743,t***d,476,Item was exactly as described and packed very well. Very happy with purchase. Thanks ,2024-07-08T07:00:00.000Z,Positive
568,234941178743,e***s,649,Great thanks,2024-06-17T07:00:00.000Z,Positive
569,234941178743,a***a,251,Great,2024-05-20T07:00:00.000Z,Positive
570,234941178743,e***x,223,Very good product and in great condition. I would recommend this seller.,2024-04-15T07:00:00.000Z,Positive
571,234941178743,l***g,642,Vac better than expected and great service after the sale ,2024-04-08T07:00:00.000Z,Positive
572,234941178743,a***7,138,Well packed and great price. Shipping is extremely fast. Highly recommend seller!,2024-04-01T07:00:00.000Z,Positive
573,234941178743,h***n,47,Quick and great product!,2024-03-25T07:00:00.000Z,Positive
574,234941178743,1***k,41,Fast shipping and accurate description. Works amazing and would definitely buy from Integrity again!,2024-02-26T07:00:00.000Z,Positive
575,234941178743,o***9,2281,Item received as described. Thanks for the auction.,2024-02-19T07:00:00.000Z,Positive
576,234941178743,-***-,762,Seller solved the problem,2024-02-19T07:00:00.000Z,Positive
577,234941178743,o***_,12,Works like it should no issues would recommend ,2024-02-12T07:00:00.000Z,Positive
578,234941178743,g***u,588,Fast shipping grade seller A+,2024-02-05T07:00:00.000Z,Positive
579,234941178743,d***e,247,"Great vacuum, exactly as described! Highly recommend this seller! Thank you!",2024-01-29T07:00:00.000Z,Positive
580,234941178743,t***s,1538,Excellent. Super clean and works great. Fast shipping! ,2024-01-29T07:00:00.000Z,Positive
581,234941178743,h***y,599,Excellent quality vacuum. Super fast shipping. Well packaged.,2024-01-29T07:00:00.000Z,Positive
582,234941178743,6***e,743,Great service!,2024-01-22T07:00:00.000Z,Positive
583,234941178743,3***3,156,Thank you ,2024-01-15T07:00:00.000Z,Positive
584,234941178743,e***t,306,Works great very powerful. Only problem is battery life doesn’t last that long before needing a charge. I don’t know if that’s normal or if that’s how was designed.,2024-01-15T07:00:00.000Z,Positive
585,234941178743,g***1,130,Prestine condition,2024-01-08T07:00:00.000Z,Positive
586,266968553516,4***d,55,A++,2024-09-23T07:00:00.000Z,Positive
587,266968553516,m***l,1,Love the vacuum but it was not new in box as described. The tools and vacuum had dust debris inside showing it had been used prior. ,2024-09-09T07:00:00.000Z,Neutral
588,276301970684,e***r,372,Love it ,2024-07-08T07:00:00.000Z,Positive
589,276301970684,g***n,58,"As promised, shipping was early!",2024-06-17T07:00:00.000Z,Positive
590,276301970684,7***7,304,Seller was willing to work with buyer.. Excellent customer service  Thank you,2024-06-17T07:00:00.000Z,Positive
591,276301970684,a***r,812,"The item arrived today. No original box as described, but no documentation (manual) of any kind. In all honestly it should be listed as new(other),. I hope my warranty registration goes without a problem.",2024-06-10T07:00:00.000Z,Positive
